{
    "Applications": {
        "UQ": {
            "Application": "Dakota-UQ",
            "ApplicationData": {
            }
        }
    },
    "EDP": [
        {
            "name": "Node_2_Disp_2"
        },
        {
            "name": "Node_3_Disp_2"
        }
    ],
    "UQ_Method": {
        "samplingMethodData": {
            "method": "LHS",
            "samples": 200,
            "seed": 553
        },
        "uqEngine": "Dakota",
        "uqType": "Forward Propagation"
    },
    "fem": {
        "dir": "{Current_Dir}/.",
        "inputFile": "{Current_Dir}/TrussTemplate.py",
        "mainInput": "TrussTemplate.py",
        "mainPostprocessScript": "postproc.py",
        "numInputs": 1,
        "parametersFile": "params.py",
        "parametersScript": "{Current_Dir}/params.py",
        "postprocessScript": "{Current_Dir}/postproc.py",
        "program": "OpenSeesPy"
    },
    "localAppDir": "C:/Tools/quoFEM/quoFEM",
    "python": "python",
    "randomVariables": [
        {
            "distribution": "Normal",
            "mean": 205,
            "name": "E",
            "refCount": 1,
            "stdDev": 10,
            "value": "RV.E",
            "variableClass": "Uncertain"
        },
        {
            "distribution": "Normal",
            "mean": 25,
            "name": "P",
            "refCount": 1,
            "stdDev": 10,
            "value": "RV.P",
            "variableClass": "Uncertain"
        },
        {
            "distribution": "Normal",
            "mean": 250,
            "name": "Ao",
            "refCount": 1,
            "stdDev": 10,
            "value": "RV.Ao",
            "variableClass": "Uncertain"
        },
        {
            "distribution": "Normal",
            "mean": 500,
            "name": "Au",
            "refCount": 1,
            "stdDev": 10,
            "value": "RV.Au",
            "variableClass": "Uncertain"
        }
    ],
    "remoteAppDir": "/home1/00477/tg457427/SimCenterBackendApplications/May-2020",
    "uqResults": {
    },
    "workingDir": "C:/Workdir/quoFEM"
}
